{
  "format": "memora-knowledge-v1",
  "version": "1.0.0",
  "origin": "11111111-1111-4111-8111-111111111111",
  "destination": "22222222-2222-4222-8222-222222222222",
  "records": [
    {
      "sources": [
        {
          "resource": "https://example.org/design"
        }
      ],
      "origin": {
        "workspace": "example-team",
        "revision": 1,
        "brain": "11111111-1111-4111-8111-111111111111"
      },
      "review": {
        "by": "human:example-reviewer",
        "at": "2026-10-31T10:00:00Z"
      },
      "provenance": {
        "created_at": "2026-10-31T09:00:00Z",
        "created_by": "agent:example",
        "updated_at": "2026-10-31T09:00:00Z",
        "updated_by": "agent:example"
      },
      "id": "33333333-3333-4333-8333-333333333333",
      "type": "Entity",
      "entity_kind": "service",
      "title": "Example service",
      "description": "A source-owned service.",
      "body": "The source system owns the service definition.",
      "external_refs": [
        {
          "provider": "7lens",
          "instance": "example-installation",
          "entity_type": "service",
          "entity_id": "compute.virtual_machines",
          "relation": "documents",
          "observed_revision": "4"
        }
      ]
    },
    {
      "sources": [
        {
          "resource": "https://example.org/design"
        }
      ],
      "origin": {
        "workspace": "example-team",
        "revision": 1,
        "brain": "11111111-1111-4111-8111-111111111111"
      },
      "review": {
        "by": "human:example-reviewer",
        "at": "2026-10-31T10:00:00Z"
      },
      "provenance": {
        "created_at": "2026-10-31T09:00:00Z",
        "created_by": "agent:example",
        "updated_at": "2026-10-31T09:00:00Z",
        "updated_by": "agent:example"
      },
      "id": "44444444-4444-4444-8444-444444444444",
      "type": "Decision",
      "title": "Keep source authority",
      "description": "Link the source entity.",
      "body": "Use an external reference because the source system owns the entity."
    }
  ],
  "relations": [
    {
      "id": "55555555-5555-4555-8555-555555555555",
      "origin": "44444444-4444-4444-8444-444444444444",
      "target": "33333333-3333-4333-8333-333333333333",
      "type": "documents"
    }
  ],
  "sha256": "8f82fda8a488ae49c63bd5e2185523f7b648aae6d8efa175dad4f8fc989c97e3"
}
